{
  "script_id": "01002003",
  "title": "祭长江",
  "genre": "历史剧",
  "nodes": [
    {
      "id": "c_孙尚香",
      "name": "孙尚香",
      "hangdang": "青衣",
      "hangdang_coarse": "旦",
      "is_main": true,
      "degree": 1,
      "weighted_degree": 7.0,
      "betweenness": 0.0,
      "weighted_betweenness": 0.0,
      "closeness": 1.0,
      "eigenvector": 0.7071,
      "community_id": 0
    },
    {
      "id": "c_龙王",
      "name": "龙王",
      "hangdang": "青衣",
      "hangdang_coarse": "旦",
      "is_main": true,
      "degree": 1,
      "weighted_degree": 7.0,
      "betweenness": 0.0,
      "weighted_betweenness": 0.0,
      "closeness": 1.0,
      "eigenvector": 0.7071,
      "community_id": 0
    }
  ],
  "links": [
    {
      "source": "c_孙尚香",
      "target": "c_龙王",
      "weight": 7.0,
      "types": [
        "对话",
        "同场"
      ],
      "dialogue_count": 3,
      "normalized_weight": 1.0
    }
  ],
  "metrics": {
    "node_count": 2,
    "edge_count": 1,
    "density": 1.0,
    "avg_clustering": 0.0,
    "avg_degree": 1.0,
    "avg_weighted_degree": 7.0,
    "component_count": 1,
    "avg_weighted_clustering": 0.0,
    "modularity": 0.0,
    "assortativity_hangdang": NaN,
    "main_subgraph": {
      "node_count": 2,
      "edge_count": 1,
      "density": 1.0,
      "avg_clustering": 0.0,
      "modularity": 0.0
    }
  }
}
