{
  "script_id": "01001010",
  "title": "黄金台",
  "genre": "家庭剧",
  "nodes": [
    {
      "id": "c_田单",
      "name": "田单",
      "hangdang": "老生",
      "hangdang_coarse": "生",
      "is_main": true,
      "degree": 8,
      "weighted_degree": 203.0,
      "betweenness": 0.2143,
      "weighted_betweenness": 0.9286,
      "closeness": 1.0,
      "eigenvector": 0.7041,
      "community_id": 0
    },
    {
      "id": "c_伊立",
      "name": "伊立",
      "hangdang": "净",
      "hangdang_coarse": "净",
      "is_main": true,
      "degree": 5,
      "weighted_degree": 143.0,
      "betweenness": 0.0,
      "weighted_betweenness": 0.25,
      "closeness": 0.7273,
      "eigenvector": 0.675,
      "community_id": 0
    },
    {
      "id": "c_田法章",
      "name": "田法章",
      "hangdang": "小生",
      "hangdang_coarse": "生",
      "is_main": true,
      "degree": 8,
      "weighted_degree": 47.0,
      "betweenness": 0.2143,
      "weighted_betweenness": 0.0,
      "closeness": 1.0,
      "eigenvector": 0.1901,
      "community_id": 0
    },
    {
      "id": "c_衙役甲",
      "name": "衙役甲",
      "hangdang": "丑",
      "hangdang_coarse": "丑",
      "is_main": true,
      "degree": 4,
      "weighted_degree": 42.0,
      "betweenness": 0.0,
      "weighted_betweenness": 0.25,
      "closeness": 0.6667,
      "eigenvector": 0.065,
      "community_id": 1
    },
    {
      "id": "c_衙役乙",
      "name": "衙役乙",
      "hangdang": "丑",
      "hangdang_coarse": "丑",
      "is_main": true,
      "degree": 4,
      "weighted_degree": 34.0,
      "betweenness": 0.0,
      "weighted_betweenness": 0.0,
      "closeness": 0.6667,
      "eigenvector": 0.0393,
      "community_id": 1
    },
    {
      "id": "c_乳娘",
      "name": "乳娘",
      "hangdang": "老旦",
      "hangdang_coarse": "旦",
      "is_main": false,
      "degree": 5,
      "weighted_degree": 19.0,
      "betweenness": 0.0,
      "weighted_betweenness": 0.0,
      "closeness": 0.7273,
      "eigenvector": 0.0667,
      "community_id": 0
    },
    {
      "id": "c_二衙役",
      "name": "二衙役",
      "hangdang": "老生",
      "hangdang_coarse": "生",
      "is_main": false,
      "degree": 4,
      "weighted_degree": 10.0,
      "betweenness": 0.0,
      "weighted_betweenness": 0.0,
      "closeness": 0.6667,
      "eigenvector": 0.0282,
      "community_id": 1
    },
    {
      "id": "c_家院",
      "name": "家院",
      "hangdang": "未知",
      "hangdang_coarse": "未知",
      "is_main": false,
      "degree": 5,
      "weighted_degree": 9.0,
      "betweenness": 0.0,
      "weighted_betweenness": 0.0,
      "closeness": 0.7273,
      "eigenvector": 0.032,
      "community_id": 0
    },
    {
      "id": "c_四校尉",
      "name": "四校尉",
      "hangdang": "未知",
      "hangdang_coarse": "未知",
      "is_main": false,
      "degree": 5,
      "weighted_degree": 7.0,
      "betweenness": 0.0,
      "weighted_betweenness": 0.0,
      "closeness": 0.7273,
      "eigenvector": 0.0216,
      "community_id": 0
    }
  ],
  "links": [
    {
      "source": "c_伊立",
      "target": "c_田单",
      "weight": 133.0,
      "types": [
        "对话",
        "同场"
      ],
      "dialogue_count": 66,
      "normalized_weight": 1.0
    },
    {
      "source": "c_田单",
      "target": "c_田法章",
      "weight": 36.0,
      "types": [
        "对话",
        "同场"
      ],
      "dialogue_count": 17,
      "normalized_weight": 0.2707
    },
    {
      "source": "c_衙役乙",
      "target": "c_衙役甲",
      "weight": 27.0,
      "types": [
        "对话",
        "同场"
      ],
      "dialogue_count": 13,
      "normalized_weight": 0.203
    },
    {
      "source": "c_田单",
      "target": "c_衙役甲",
      "weight": 11.0,
      "types": [
        "对话",
        "同场"
      ],
      "dialogue_count": 5,
      "normalized_weight": 0.0827
    },
    {
      "source": "c_乳娘",
      "target": "c_田单",
      "weight": 7.0,
      "types": [
        "对话",
        "同场"
      ],
      "dialogue_count": 3,
      "normalized_weight": 0.0526
    },
    {
      "source": "c_乳娘",
      "target": "c_伊立",
      "weight": 5.0,
      "types": [
        "对话",
        "同场"
      ],
      "dialogue_count": 2,
      "normalized_weight": 0.0376
    },
    {
      "source": "c_乳娘",
      "target": "c_田法章",
      "weight": 5.0,
      "types": [
        "对话",
        "同场"
      ],
      "dialogue_count": 2,
      "normalized_weight": 0.0376
    },
    {
      "source": "c_二衙役",
      "target": "c_田单",
      "weight": 5.0,
      "types": [
        "对话",
        "同场"
      ],
      "dialogue_count": 2,
      "normalized_weight": 0.0376
    },
    {
      "source": "c_家院",
      "target": "c_田单",
      "weight": 5.0,
      "types": [
        "对话",
        "同场"
      ],
      "dialogue_count": 2,
      "normalized_weight": 0.0376
    },
    {
      "source": "c_田单",
      "target": "c_衙役乙",
      "weight": 5.0,
      "types": [
        "对话",
        "同场"
      ],
      "dialogue_count": 2,
      "normalized_weight": 0.0376
    },
    {
      "source": "c_二衙役",
      "target": "c_衙役甲",
      "weight": 3.0,
      "types": [
        "对话",
        "同场"
      ],
      "dialogue_count": 1,
      "normalized_weight": 0.0226
    },
    {
      "source": "c_伊立",
      "target": "c_四校尉",
      "weight": 3.0,
      "types": [
        "对话",
        "同场"
      ],
      "dialogue_count": 1,
      "normalized_weight": 0.0226
    },
    {
      "source": "c_乳娘",
      "target": "c_四校尉",
      "weight": 1.0,
      "types": [
        "同场"
      ],
      "dialogue_count": 0,
      "normalized_weight": 0.0075
    },
    {
      "source": "c_乳娘",
      "target": "c_家院",
      "weight": 1.0,
      "types": [
        "同场"
      ],
      "dialogue_count": 0,
      "normalized_weight": 0.0075
    },
    {
      "source": "c_二衙役",
      "target": "c_田法章",
      "weight": 1.0,
      "types": [
        "同场"
      ],
      "dialogue_count": 0,
      "normalized_weight": 0.0075
    },
    {
      "source": "c_二衙役",
      "target": "c_衙役乙",
      "weight": 1.0,
      "types": [
        "同场"
      ],
      "dialogue_count": 0,
      "normalized_weight": 0.0075
    },
    {
      "source": "c_伊立",
      "target": "c_家院",
      "weight": 1.0,
      "types": [
        "同场"
      ],
      "dialogue_count": 0,
      "normalized_weight": 0.0075
    },
    {
      "source": "c_伊立",
      "target": "c_田法章",
      "weight": 1.0,
      "types": [
        "同场"
      ],
      "dialogue_count": 0,
      "normalized_weight": 0.0075
    },
    {
      "source": "c_四校尉",
      "target": "c_家院",
      "weight": 1.0,
      "types": [
        "同场"
      ],
      "dialogue_count": 0,
      "normalized_weight": 0.0075
    },
    {
      "source": "c_四校尉",
      "target": "c_田单",
      "weight": 1.0,
      "types": [
        "同场"
      ],
      "dialogue_count": 0,
      "normalized_weight": 0.0075
    },
    {
      "source": "c_四校尉",
      "target": "c_田法章",
      "weight": 1.0,
      "types": [
        "同场"
      ],
      "dialogue_count": 0,
      "normalized_weight": 0.0075
    },
    {
      "source": "c_家院",
      "target": "c_田法章",
      "weight": 1.0,
      "types": [
        "同场"
      ],
      "dialogue_count": 0,
      "normalized_weight": 0.0075
    },
    {
      "source": "c_田法章",
      "target": "c_衙役乙",
      "weight": 1.0,
      "types": [
        "同场"
      ],
      "dialogue_count": 0,
      "normalized_weight": 0.0075
    },
    {
      "source": "c_田法章",
      "target": "c_衙役甲",
      "weight": 1.0,
      "types": [
        "同场"
      ],
      "dialogue_count": 0,
      "normalized_weight": 0.0075
    }
  ],
  "metrics": {
    "node_count": 9,
    "edge_count": 24,
    "density": 0.6667,
    "avg_clustering": 0.9048,
    "avg_degree": 5.33,
    "avg_weighted_degree": 57.11,
    "component_count": 1,
    "avg_weighted_clustering": 0.0299,
    "modularity": 0.1853,
    "assortativity_hangdang": -0.0793,
    "main_subgraph": {
      "node_count": 5,
      "edge_count": 8,
      "density": 0.8,
      "avg_clustering": 0.0649,
      "modularity": 0.1951
    }
  }
}
