{
  "script_id": "01001003",
  "title": "三娘教子",
  "genre": "家庭剧",
  "nodes": [
    {
      "id": "c_薛倚哥",
      "name": "薛倚哥",
      "hangdang": "小生",
      "hangdang_coarse": "生",
      "is_main": true,
      "degree": 2,
      "weighted_degree": 134.0,
      "betweenness": 0.0,
      "weighted_betweenness": 0.0,
      "closeness": 1.0,
      "eigenvector": 0.63,
      "community_id": 0
    },
    {
      "id": "c_王春娥",
      "name": "王春娥",
      "hangdang": "青衣",
      "hangdang_coarse": "旦",
      "is_main": true,
      "degree": 2,
      "weighted_degree": 120.0,
      "betweenness": 0.0,
      "weighted_betweenness": 0.0,
      "closeness": 1.0,
      "eigenvector": 0.5946,
      "community_id": 0
    },
    {
      "id": "c_薛保",
      "name": "薛保",
      "hangdang": "小生",
      "hangdang_coarse": "生",
      "is_main": true,
      "degree": 2,
      "weighted_degree": 96.0,
      "betweenness": 0.0,
      "weighted_betweenness": 0.0,
      "closeness": 1.0,
      "eigenvector": 0.4996,
      "community_id": 0
    }
  ],
  "links": [
    {
      "source": "c_王春娥",
      "target": "c_薛倚哥",
      "weight": 79.0,
      "types": [
        "对话",
        "同场"
      ],
      "dialogue_count": 39,
      "normalized_weight": 1.0
    },
    {
      "source": "c_薛保",
      "target": "c_薛倚哥",
      "weight": 55.0,
      "types": [
        "对话",
        "同场"
      ],
      "dialogue_count": 27,
      "normalized_weight": 0.6962
    },
    {
      "source": "c_王春娥",
      "target": "c_薛保",
      "weight": 41.0,
      "types": [
        "对话",
        "同场"
      ],
      "dialogue_count": 20,
      "normalized_weight": 0.519
    }
  ],
  "metrics": {
    "node_count": 3,
    "edge_count": 3,
    "density": 1.0,
    "avg_clustering": 1.0,
    "avg_degree": 2.0,
    "avg_weighted_degree": 116.67,
    "component_count": 1,
    "avg_weighted_clustering": 0.7122,
    "modularity": 0.0,
    "assortativity_hangdang": -0.5,
    "main_subgraph": {
      "node_count": 3,
      "edge_count": 3,
      "density": 1.0,
      "avg_clustering": 0.7122,
      "modularity": 0.0
    }
  }
}
