{
  "script_id": "01001002",
  "title": "洪羊洞",
  "genre": "历史剧",
  "nodes": [
    {
      "id": "c_程宣",
      "name": "程宣",
      "hangdang": "丑",
      "hangdang_coarse": "丑",
      "is_main": true,
      "degree": 4,
      "weighted_degree": 110.0,
      "betweenness": 0.0444,
      "weighted_betweenness": 0.0222,
      "closeness": 0.5882,
      "eigenvector": 0.6289,
      "community_id": 0
    },
    {
      "id": "c_杨延昭",
      "name": "杨延昭",
      "hangdang": "老生",
      "hangdang_coarse": "生",
      "is_main": true,
      "degree": 8,
      "weighted_degree": 109.0,
      "betweenness": 0.563,
      "weighted_betweenness": 0.7778,
      "closeness": 0.8333,
      "eigenvector": 0.56,
      "community_id": 0
    },
    {
      "id": "c_孟良",
      "name": "孟良",
      "hangdang": "净",
      "hangdang_coarse": "净",
      "is_main": true,
      "degree": 5,
      "weighted_degree": 79.0,
      "betweenness": 0.063,
      "weighted_betweenness": 0.0,
      "closeness": 0.625,
      "eigenvector": 0.5182,
      "community_id": 0
    },
    {
      "id": "c_家院",
      "name": "家院",
      "hangdang": "武生",
      "hangdang_coarse": "生",
      "is_main": false,
      "degree": 5,
      "weighted_degree": 30.0,
      "betweenness": 0.063,
      "weighted_betweenness": 0.1556,
      "closeness": 0.625,
      "eigenvector": 0.1145,
      "community_id": 2
    },
    {
      "id": "c_赵德芳",
      "name": "赵德芳",
      "hangdang": "老生",
      "hangdang_coarse": "生",
      "is_main": true,
      "degree": 5,
      "weighted_degree": 23.0,
      "betweenness": 0.2,
      "weighted_betweenness": 0.3778,
      "closeness": 0.625,
      "eigenvector": 0.049,
      "community_id": 1
    },
    {
      "id": "c_焦赞",
      "name": "焦赞",
      "hangdang": "净",
      "hangdang_coarse": "净",
      "is_main": false,
      "degree": 3,
      "weighted_degree": 21.0,
      "betweenness": 0.0,
      "weighted_betweenness": 0.0,
      "closeness": 0.4348,
      "eigenvector": 0.0716,
      "community_id": 2
    },
    {
      "id": "c_杨宗保",
      "name": "杨宗保",
      "hangdang": "小生",
      "hangdang_coarse": "生",
      "is_main": false,
      "degree": 4,
      "weighted_degree": 18.0,
      "betweenness": 0.0,
      "weighted_betweenness": 0.0,
      "closeness": 0.5882,
      "eigenvector": 0.0268,
      "community_id": 1
    },
    {
      "id": "c_佘太君",
      "name": "佘太君",
      "hangdang": "老旦",
      "hangdang_coarse": "旦",
      "is_main": false,
      "degree": 4,
      "weighted_degree": 6.0,
      "betweenness": 0.0,
      "weighted_betweenness": 0.0,
      "closeness": 0.5882,
      "eigenvector": 0.0202,
      "community_id": 0
    },
    {
      "id": "c_柴夫人",
      "name": "柴夫人",
      "hangdang": "青衣",
      "hangdang_coarse": "旦",
      "is_main": false,
      "degree": 4,
      "weighted_degree": 6.0,
      "betweenness": 0.0,
      "weighted_betweenness": 0.0,
      "closeness": 0.5882,
      "eigenvector": 0.0202,
      "community_id": 0
    },
    {
      "id": "c_杨继业",
      "name": "杨继业",
      "hangdang": "小生",
      "hangdang_coarse": "生",
      "is_main": true,
      "degree": 3,
      "weighted_degree": 3.0,
      "betweenness": 0.0,
      "weighted_betweenness": 0.0,
      "closeness": 0.5556,
      "eigenvector": 0.0136,
      "community_id": 3
    },
    {
      "id": "c_大太监",
      "name": "大太监",
      "hangdang": "未知",
      "hangdang_coarse": "未知",
      "is_main": false,
      "degree": 1,
      "weighted_degree": 1.0,
      "betweenness": 0.0,
      "weighted_betweenness": 0.0,
      "closeness": 0.4,
      "eigenvector": 0.0006,
      "community_id": 4
    }
  ],
  "links": [
    {
      "source": "c_杨延昭",
      "target": "c_程宣",
      "weight": 53.0,
      "types": [
        "对话",
        "同场"
      ],
      "dialogue_count": 26,
      "normalized_weight": 1.0
    },
    {
      "source": "c_孟良",
      "target": "c_程宣",
      "weight": 48.0,
      "types": [
        "对话",
        "同场"
      ],
      "dialogue_count": 23,
      "normalized_weight": 0.9057
    },
    {
      "source": "c_孟良",
      "target": "c_杨延昭",
      "weight": 27.0,
      "types": [
        "对话",
        "同场"
      ],
      "dialogue_count": 13,
      "normalized_weight": 0.5094
    },
    {
      "source": "c_家院",
      "target": "c_焦赞",
      "weight": 13.0,
      "types": [
        "对话",
        "同场"
      ],
      "dialogue_count": 6,
      "normalized_weight": 0.2453
    },
    {
      "source": "c_杨宗保",
      "target": "c_赵德芳",
      "weight": 13.0,
      "types": [
        "对话",
        "同场"
      ],
      "dialogue_count": 6,
      "normalized_weight": 0.2453
    },
    {
      "source": "c_家院",
      "target": "c_杨延昭",
      "weight": 12.0,
      "types": [
        "对话",
        "同场"
      ],
      "dialogue_count": 5,
      "normalized_weight": 0.2264
    },
    {
      "source": "c_杨延昭",
      "target": "c_赵德芳",
      "weight": 7.0,
      "types": [
        "对话",
        "同场"
      ],
      "dialogue_count": 3,
      "normalized_weight": 0.1321
    },
    {
      "source": "c_焦赞",
      "target": "c_程宣",
      "weight": 6.0,
      "types": [
        "对话",
        "同场"
      ],
      "dialogue_count": 2,
      "normalized_weight": 0.1132
    },
    {
      "source": "c_佘太君",
      "target": "c_杨延昭",
      "weight": 3.0,
      "types": [
        "对话",
        "同场"
      ],
      "dialogue_count": 1,
      "normalized_weight": 0.0566
    },
    {
      "source": "c_家院",
      "target": "c_程宣",
      "weight": 3.0,
      "types": [
        "对话",
        "同场"
      ],
      "dialogue_count": 1,
      "normalized_weight": 0.0566
    },
    {
      "source": "c_杨宗保",
      "target": "c_杨延昭",
      "weight": 3.0,
      "types": [
        "对话",
        "同场"
      ],
      "dialogue_count": 1,
      "normalized_weight": 0.0566
    },
    {
      "source": "c_杨延昭",
      "target": "c_柴夫人",
      "weight": 3.0,
      "types": [
        "对话",
        "同场"
      ],
      "dialogue_count": 1,
      "normalized_weight": 0.0566
    },
    {
      "source": "c_孟良",
      "target": "c_焦赞",
      "weight": 2.0,
      "types": [
        "同场"
      ],
      "dialogue_count": 0,
      "normalized_weight": 0.0377
    },
    {
      "source": "c_佘太君",
      "target": "c_杨宗保",
      "weight": 1.0,
      "types": [
        "同场"
      ],
      "dialogue_count": 0,
      "normalized_weight": 0.0189
    },
    {
      "source": "c_佘太君",
      "target": "c_柴夫人",
      "weight": 1.0,
      "types": [
        "同场"
      ],
      "dialogue_count": 0,
      "normalized_weight": 0.0189
    },
    {
      "source": "c_佘太君",
      "target": "c_赵德芳",
      "weight": 1.0,
      "types": [
        "同场"
      ],
      "dialogue_count": 0,
      "normalized_weight": 0.0189
    },
    {
      "source": "c_大太监",
      "target": "c_赵德芳",
      "weight": 1.0,
      "types": [
        "同场"
      ],
      "dialogue_count": 0,
      "normalized_weight": 0.0189
    },
    {
      "source": "c_孟良",
      "target": "c_家院",
      "weight": 1.0,
      "types": [
        "同场"
      ],
      "dialogue_count": 0,
      "normalized_weight": 0.0189
    },
    {
      "source": "c_孟良",
      "target": "c_杨继业",
      "weight": 1.0,
      "types": [
        "同场"
      ],
      "dialogue_count": 0,
      "normalized_weight": 0.0189
    },
    {
      "source": "c_家院",
      "target": "c_杨继业",
      "weight": 1.0,
      "types": [
        "同场"
      ],
      "dialogue_count": 0,
      "normalized_weight": 0.0189
    },
    {
      "source": "c_杨宗保",
      "target": "c_柴夫人",
      "weight": 1.0,
      "types": [
        "同场"
      ],
      "dialogue_count": 0,
      "normalized_weight": 0.0189
    },
    {
      "source": "c_杨延昭",
      "target": "c_杨继业",
      "weight": 1.0,
      "types": [
        "同场"
      ],
      "dialogue_count": 0,
      "normalized_weight": 0.0189
    },
    {
      "source": "c_柴夫人",
      "target": "c_赵德芳",
      "weight": 1.0,
      "types": [
        "同场"
      ],
      "dialogue_count": 0,
      "normalized_weight": 0.0189
    }
  ],
  "metrics": {
    "node_count": 11,
    "edge_count": 23,
    "density": 0.4182,
    "avg_clustering": 0.7478,
    "avg_degree": 4.18,
    "avg_weighted_degree": 36.91,
    "component_count": 1,
    "avg_weighted_clustering": 0.0718,
    "modularity": 0.1841,
    "assortativity_hangdang": -0.0253,
    "main_subgraph": {
      "node_count": 5,
      "edge_count": 6,
      "density": 0.6,
      "avg_clustering": 0.2488,
      "modularity": 0.0
    }
  }
}
