{
  "script_id": "01001012",
  "title": "黄鹤楼",
  "genre": "历史剧",
  "nodes": [
    {
      "id": "c_刘备",
      "name": "刘备",
      "hangdang": "老生",
      "hangdang_coarse": "生",
      "is_main": true,
      "degree": 7,
      "weighted_degree": 176.0,
      "betweenness": 0.2302,
      "weighted_betweenness": 0.7143,
      "closeness": 1.0,
      "eigenvector": 0.6,
      "community_id": 0
    },
    {
      "id": "c_周瑜",
      "name": "周瑜",
      "hangdang": "小生",
      "hangdang_coarse": "生",
      "is_main": true,
      "degree": 4,
      "weighted_degree": 149.0,
      "betweenness": 0.0159,
      "weighted_betweenness": 0.5238,
      "closeness": 0.7,
      "eigenvector": 0.53,
      "community_id": 0
    },
    {
      "id": "c_赵云",
      "name": "赵云",
      "hangdang": "小生",
      "hangdang_coarse": "生",
      "is_main": true,
      "degree": 7,
      "weighted_degree": 112.0,
      "betweenness": 0.2302,
      "weighted_betweenness": 0.0,
      "closeness": 1.0,
      "eigenvector": 0.4274,
      "community_id": 1
    },
    {
      "id": "c_诸葛亮",
      "name": "诸葛亮",
      "hangdang": "老生",
      "hangdang_coarse": "生",
      "is_main": true,
      "degree": 4,
      "weighted_degree": 92.0,
      "betweenness": 0.0,
      "weighted_betweenness": 0.2857,
      "closeness": 0.7,
      "eigenvector": 0.3192,
      "community_id": 1
    },
    {
      "id": "c_鲁肃",
      "name": "鲁肃",
      "hangdang": "老生",
      "hangdang_coarse": "生",
      "is_main": false,
      "degree": 3,
      "weighted_degree": 53.0,
      "betweenness": 0.0,
      "weighted_betweenness": 0.0,
      "closeness": 0.6364,
      "eigenvector": 0.2331,
      "community_id": 0
    },
    {
      "id": "c_甘宁",
      "name": "甘宁",
      "hangdang": "武生",
      "hangdang_coarse": "生",
      "is_main": false,
      "degree": 3,
      "weighted_degree": 26.0,
      "betweenness": 0.0,
      "weighted_betweenness": 0.0,
      "closeness": 0.6364,
      "eigenvector": 0.1153,
      "community_id": 0
    },
    {
      "id": "c_张飞",
      "name": "张飞",
      "hangdang": "净",
      "hangdang_coarse": "净",
      "is_main": true,
      "degree": 4,
      "weighted_degree": 24.0,
      "betweenness": 0.0,
      "weighted_betweenness": 0.0,
      "closeness": 0.7,
      "eigenvector": 0.0653,
      "community_id": 1
    },
    {
      "id": "c_刘封",
      "name": "刘封",
      "hangdang": "小生",
      "hangdang_coarse": "生",
      "is_main": false,
      "degree": 4,
      "weighted_degree": 12.0,
      "betweenness": 0.0,
      "weighted_betweenness": 0.0,
      "closeness": 0.7,
      "eigenvector": 0.0521,
      "community_id": 0
    }
  ],
  "links": [
    {
      "source": "c_刘备",
      "target": "c_周瑜",
      "weight": 71.0,
      "types": [
        "对话",
        "同场"
      ],
      "dialogue_count": 34,
      "normalized_weight": 1.0
    },
    {
      "source": "c_刘备",
      "target": "c_赵云",
      "weight": 43.0,
      "types": [
        "对话",
        "同场"
      ],
      "dialogue_count": 20,
      "normalized_weight": 0.6056
    },
    {
      "source": "c_刘备",
      "target": "c_诸葛亮",
      "weight": 39.0,
      "types": [
        "对话",
        "同场"
      ],
      "dialogue_count": 19,
      "normalized_weight": 0.5493
    },
    {
      "source": "c_周瑜",
      "target": "c_鲁肃",
      "weight": 35.0,
      "types": [
        "对话",
        "同场"
      ],
      "dialogue_count": 17,
      "normalized_weight": 0.493
    },
    {
      "source": "c_诸葛亮",
      "target": "c_赵云",
      "weight": 31.0,
      "types": [
        "对话",
        "同场"
      ],
      "dialogue_count": 15,
      "normalized_weight": 0.4366
    },
    {
      "source": "c_周瑜",
      "target": "c_赵云",
      "weight": 24.0,
      "types": [
        "对话",
        "同场"
      ],
      "dialogue_count": 11,
      "normalized_weight": 0.338
    },
    {
      "source": "c_张飞",
      "target": "c_诸葛亮",
      "weight": 21.0,
      "types": [
        "对话",
        "同场"
      ],
      "dialogue_count": 10,
      "normalized_weight": 0.2958
    },
    {
      "source": "c_周瑜",
      "target": "c_甘宁",
      "weight": 19.0,
      "types": [
        "对话",
        "同场"
      ],
      "dialogue_count": 8,
      "normalized_weight": 0.2676
    },
    {
      "source": "c_刘备",
      "target": "c_刘封",
      "weight": 9.0,
      "types": [
        "对话",
        "同场"
      ],
      "dialogue_count": 4,
      "normalized_weight": 0.1268
    },
    {
      "source": "c_刘备",
      "target": "c_鲁肃",
      "weight": 9.0,
      "types": [
        "对话",
        "同场"
      ],
      "dialogue_count": 4,
      "normalized_weight": 0.1268
    },
    {
      "source": "c_赵云",
      "target": "c_鲁肃",
      "weight": 9.0,
      "types": [
        "对话",
        "同场"
      ],
      "dialogue_count": 4,
      "normalized_weight": 0.1268
    },
    {
      "source": "c_刘备",
      "target": "c_甘宁",
      "weight": 4.0,
      "types": [
        "对话",
        "同场"
      ],
      "dialogue_count": 1,
      "normalized_weight": 0.0563
    },
    {
      "source": "c_甘宁",
      "target": "c_赵云",
      "weight": 3.0,
      "types": [
        "对话",
        "同场"
      ],
      "dialogue_count": 1,
      "normalized_weight": 0.0423
    },
    {
      "source": "c_刘备",
      "target": "c_张飞",
      "weight": 1.0,
      "types": [
        "同场"
      ],
      "dialogue_count": 0,
      "normalized_weight": 0.0141
    },
    {
      "source": "c_刘封",
      "target": "c_张飞",
      "weight": 1.0,
      "types": [
        "同场"
      ],
      "dialogue_count": 0,
      "normalized_weight": 0.0141
    },
    {
      "source": "c_刘封",
      "target": "c_诸葛亮",
      "weight": 1.0,
      "types": [
        "同场"
      ],
      "dialogue_count": 0,
      "normalized_weight": 0.0141
    },
    {
      "source": "c_刘封",
      "target": "c_赵云",
      "weight": 1.0,
      "types": [
        "同场"
      ],
      "dialogue_count": 0,
      "normalized_weight": 0.0141
    },
    {
      "source": "c_张飞",
      "target": "c_赵云",
      "weight": 1.0,
      "types": [
        "同场"
      ],
      "dialogue_count": 0,
      "normalized_weight": 0.0141
    }
  ],
  "metrics": {
    "node_count": 8,
    "edge_count": 18,
    "density": 0.6429,
    "avg_clustering": 0.8601,
    "avg_degree": 4.5,
    "avg_weighted_degree": 80.5,
    "component_count": 1,
    "avg_weighted_clustering": 0.1561,
    "modularity": 0.0785,
    "assortativity_hangdang": -0.125,
    "main_subgraph": {
      "node_count": 5,
      "edge_count": 8,
      "density": 0.8,
      "avg_clustering": 0.2761,
      "modularity": 0.06
    }
  }
}
