{
  "script_id": "01001020",
  "title": "宋江闹院",
  "genre": "历史剧",
  "nodes": [
    {
      "id": "c_阎惜姣",
      "name": "阎惜姣",
      "hangdang": "花旦",
      "hangdang_coarse": "旦",
      "is_main": true,
      "degree": 3,
      "weighted_degree": 474.0,
      "betweenness": 0.0,
      "weighted_betweenness": 0.6667,
      "closeness": 1.0,
      "eigenvector": 0.7062,
      "community_id": 0
    },
    {
      "id": "c_宋江",
      "name": "宋江",
      "hangdang": "老生",
      "hangdang_coarse": "生",
      "is_main": true,
      "degree": 3,
      "weighted_degree": 379.0,
      "betweenness": 0.0,
      "weighted_betweenness": 0.6667,
      "closeness": 1.0,
      "eigenvector": 0.68,
      "community_id": 0
    },
    {
      "id": "c_张文远",
      "name": "张文远",
      "hangdang": "丑",
      "hangdang_coarse": "丑",
      "is_main": true,
      "degree": 3,
      "weighted_degree": 108.0,
      "betweenness": 0.0,
      "weighted_betweenness": 0.0,
      "closeness": 1.0,
      "eigenvector": 0.1965,
      "community_id": 0
    },
    {
      "id": "c_众人",
      "name": "众人",
      "hangdang": "未知",
      "hangdang_coarse": "未知",
      "is_main": true,
      "degree": 3,
      "weighted_degree": 9.0,
      "betweenness": 0.0,
      "weighted_betweenness": 0.0,
      "closeness": 1.0,
      "eigenvector": 0.0147,
      "community_id": 0
    }
  ],
  "links": [
    {
      "source": "c_宋江",
      "target": "c_阎惜姣",
      "weight": 369.0,
      "types": [
        "对话",
        "同场"
      ],
      "dialogue_count": 184,
      "normalized_weight": 1.0
    },
    {
      "source": "c_张文远",
      "target": "c_阎惜姣",
      "weight": 104.0,
      "types": [
        "对话",
        "同场"
      ],
      "dialogue_count": 51,
      "normalized_weight": 0.2818
    },
    {
      "source": "c_众人",
      "target": "c_宋江",
      "weight": 7.0,
      "types": [
        "对话",
        "同场"
      ],
      "dialogue_count": 3,
      "normalized_weight": 0.019
    },
    {
      "source": "c_宋江",
      "target": "c_张文远",
      "weight": 3.0,
      "types": [
        "对话",
        "同场"
      ],
      "dialogue_count": 1,
      "normalized_weight": 0.0081
    },
    {
      "source": "c_众人",
      "target": "c_张文远",
      "weight": 1.0,
      "types": [
        "同场"
      ],
      "dialogue_count": 0,
      "normalized_weight": 0.0027
    },
    {
      "source": "c_众人",
      "target": "c_阎惜姣",
      "weight": 1.0,
      "types": [
        "同场"
      ],
      "dialogue_count": 0,
      "normalized_weight": 0.0027
    }
  ],
  "metrics": {
    "node_count": 4,
    "edge_count": 6,
    "density": 1.0,
    "avg_clustering": 1.0,
    "avg_degree": 3.0,
    "avg_weighted_degree": 242.5,
    "component_count": 1,
    "avg_weighted_clustering": 0.0473,
    "modularity": 0.0,
    "assortativity_hangdang": -0.3333,
    "main_subgraph": {
      "node_count": 4,
      "edge_count": 6,
      "density": 1.0,
      "avg_clustering": 0.0473,
      "modularity": 0.0
    }
  }
}
